movie,sentence,score
탑건: 매버릭,브래드쇼 아들 루스터가 피아노치는모습을 보면서 과거를 회상하는  장면에서..울컥,10
탑건: 매버릭,톰 크루즈 형님이 전투기를 몰자 내 맘 속에도 파동이....,10
탑건: 매버릭,영화는 이렇게 만들어야 합니다.,10
탑건: 매버릭,최근 10년내 본 영화 중 최고다. 아직도 여운이 긴시지 않는다,10
탑건: 매버릭,해피엔딩일거 예상했지만 흥미진진하고 박진감넘쳤음 그리고 그래픽 너무 좋았음,10
탑건: 매버릭,정말 웬만해서 후기안남기는데 오늘 너무 재밌게 관람했습니다! 인생영화에 등극한것같습니다.  영상미도 뛰어나고 스토리도 1편이랑 잘엮어서 잘 짠거같아요 그리고 톰크루즈는 여전히 멋있네요..!!!,10
범죄도시2,"배우님들의 박진감 넘치는 연기와 환상적 연출의 만남 , 완벽… 보는내내 긴장,웃음,속시원함에 시간가는줄 모르고 봤어요! 몇번을 봐도 안질리네요극장나오면 손석구배우님만 생각나기도 함 . ㅎ",10
탑건: 매버릭,잘빠진 장르영화에 톰크루즈 한스푼. 실패가 없는 조합,10
탑건: 매버릭,또 봐도 됨!!! 10자 채우기,10
탑건: 매버릭,오랜만에 진짜 재밌는 영화였어요,10
탑건: 매버릭,넘~ 재미있고 감동적 입니다.,10
탑건: 매버릭,말이 필요없는 최고의 후속작,10
탑건: 매버릭,역시 톰아저씨믿고봐요,10
탑건: 매버릭,솔직히 스토리는 탑건1편의 재탕이지만 그래서 더 좋아하는 사람도 있고 무엇보다 전투기 액션씬이 역대 전투기 액션신중 최고임 게다가 이게 대부분 CG가 아니라 실사라는 것이 놀라움,10
범죄도시2,마헐크 최고다진짜~!! 손석구 연기도 소름~~,10
탑건: 매버릭,팬더믹을 지나는 상징은 필요하니...,8
마녀(魔女) Part2. The Other One,3편으로 넘어가기 위한 영화였음. 사람들이 재미없다고 해서 기대 1도 안하고 봤는데 2시간 내내 집중해서 볼 수 있었고 또 액션신이 1편에 비해 상당히 볼 것이 많았음 스토리가 다소 부족하더라도 마지막 김다미가 나오면서 스토리에 대한 생각은 1도 안들었음 신시아 또한 표정연기가 좋아서 신인배우인지도 몰랐고 3편이 기다려지는 영화임,10
탑건: 매버릭,진짜미쳤다 두시간내내 바지 흥건해짐. ㄹㅇ 요강가져가야함,10
탑건: 매버릭,끝까지 손에 땀쥠ㅎㅎ 돈이 한푼도 안아까운 영화,10
마녀(魔女) Part2. The Other One,마녀 투 이즈 저스트 굿 투미,10
탑건: 매버릭,"탑건의 속편이 나오기까지 오랜세월이 흘렀지만 톰크루즈 형님은 여전히 카리스마 넘치고, 더 멋있어진것 같은 느낌이 든다.전투기 조종조차도 본인이 거의 조종을 했다니 이 영화는 꼭 극장에서 관람해야한다.",10
탑건: 매버릭,ㄹㅇ꼭 영화관에서 보세요,10
탑건: 매버릭,진짜 잘 만든 영화에요.,10
탑건: 매버릭,마지막 공중전은 진짜 볼만했네요,10
탑건: 매버릭,최고 최고 최고 최고 최고,10
탑건: 매버릭,상업 영화 중 최고의 영화 관객을 위한 영화,10
탑건: 매버릭,"굿~~    욕이나  폭력,  자극적인 것 없이  너무 좋습니다.   뭉클함도  있고  영화끝나고 기분이 좋은 영화입니다.  탐  크루즈,  나이  들어도 너무 멋있어요!",10
탑건: 매버릭,우선 탐크루즈만으로 끝.추격전 등 볼거리도 화려하고 간만에 보는 헐리우드 영화다운 헐리우드 영화였습니다!!,10
탑건: 매버릭,최고의 영화였어요. 극장에서 또 봐야겠어요.,10
탑건: 매버릭,최고의 감동!최고의 영화!,10
탑건: 매버릭,영화관에서 안보면 후회,10
모어,영화도 다큐멘터리도 아닌 모어 모지민의 에세이,10
탑건: 매버릭,탑건 ost와 곁들인 톰크루즈가 오토바이 몰며 활주로를 달릴때 그리고 모든 전투기씬은 찌든 삶을 한방에 벗겨버리듯 속이 뻥뚤리고 웅장하며 눈물까지 몰려온다 모든 배우들의 연기와 감정선이 탁월하다 뻔한 스토리와 반전없는 전개를 실제같은 미친 영상미와 배우들의 연기 감정선으로 박살낸 무조건 봐야하는 명작이다,9
스트리트 파이터,87년 아재의 어릴적 레전드 슈퍼 게임이 스트리트 파이터였는데영화로 봤는데 너무 잘 만들었고 완전 신나게 잘 즐겨 봤다상상을 초월 했네 화려한 액션 격투 장면은 역대 넘버 탑이었다~~반담 형님 아주 매력적이야 90년대 그 시절 추억이었다옛날 감성 오지게 받넹,10
탑건: 매버릭,기대 안하고 봤는데 너무 재밌게 보고왔어요 !,10
탑건: 매버릭,미쳤다 진짜 소름이 ㄷㄷ,10
탑건: 매버릭,뻔한 스토리 이지만 배우와 영상미가 너무 멋진 영화입니다.,10
탑건: 매버릭,정말 정말 잘만든듯ㅎㅎㅎ한번더 보고싶네요,10
탑건: 매버릭,이거 지금 극장에서 안보고 나중에 TV나 다른걸로 보면 무조건 후회합니다.. 제발 극장에서 보셔야해요!! 전 일반관에서 봤는데 screenx로 또 예매해놨어요~,10
탑건: 매버릭,화면 작은데서 봐서 그런가 보는내내 지겨워서 간만에 극장서 잠들뻔. 범죄도시를 다시보고말지. 이게무슨 팝콘무비야 그냥 클리쉐 비빔밥이지. 비행기 전투씬이야 칭찬받을만한데 이빨쑤시는 마초남은 어느시대 캐릭터인지도 모르겠고. 아 4050틀딱들은 좋아하겠네,4
탑건: 매버릭,마녀2랑 재다가 평점보고 선택했는데 옳은 선택이였다. 톰 나이들어도 멋있어,10
탑건: 매버릭,"Don’t think, Just do.",10
탑건: 매버릭,최근 본 영화중에 최고!,10
범죄도시2,한국영화는 이래야 된다를 아주 잘보여준 2022 최고의 영화중 하나,10
탑건: 매버릭,그냥 평점높은 이유가 있네요,10
마녀(魔女) Part2. The Other One,"유치하고 ㅠ 욕하는 연기들도 어색 ㅠ 관람 시간아깝… 1편을 짜집기한듯한…이번 편은 실망했지만, 3편을 기대해볼게요…",4
탑건: 매버릭,연출 연기 스토리 영상미 ost 까지 다섯박자가 모두 완 벽,10
탑건: 매버릭,오랜만에 여운이 남는 영화였어요,10
탑건: 매버릭,"한 줄 요약- 장인은 도구를 탓하지 않는다.꼭 보시길.. 단순한 재미 뿐만 아니라 ai에게 일자리 밀리고, 무인으로 대체되는 미래에서 생명체와 인간이란 어떤 의미를 가질 수 있을지 생각해볼만한 영화. 진짜 재밌으니 꼭 보시길",10
탑건: 매버릭,지루하지 않고 진짜 재미있어요~~톰크루즈는 정말 여전하네요~너무 멋진 영화 잘봤습니다,10
탑건: 매버릭,딱한마디로 정리가능 최고.,10
탑건: 매버릭,하아....그래..이 감성이지!!!,10
허슬,감동과 열정이 있는 진짜 좋은 영화,10
범죄도시2,"예상가능한 대사들과 비급스토리좀 잔인하지만, 액션 굳손석구의  팬이 됨 ㅎ",8
닥터 스트레인지: 대혼돈의 멀티버스,아니 진짜 재미없었어요? 마블이 마블했는데 완다 드라마를 보고나서 보니 더욱더 재밌게 잘 봤습니다. 영화 속 주인공이 꼭 스트레인지일 필요는 없죠. 눈호강 하면서 설렘 가득안고 잘봤습니다,10
탑건: 매버릭,OTT 홍수 속 이유있는 진주,10
몬스터 싱어: 매직 인 파리,ost가 좋네요! 잘보았습니다^^,9
데드락: 라스트 리벤지,1점도 아깝다빵점이 없는게아쉽네,1
탑건: 매버릭,탐크루즈의 연기와 1편의 영화대비해서 정말재미있었다,10
탑건: 매버릭,미국미국스러운 영화 너무 좋았더,10
탑건: 매버릭,이거보다나은 후속작이 있을까?,10
탑건: 매버릭,탐쿠르즈 전형적인 배우라 생각했는데 독보적인 배우! 말 그대로 매버릭!,10
인디아나 존스: 크리스탈 해골의 왕국,최소 8.5는 되야지 인디아나존스 또 나왔으면 좋겠다,8
탑건: 매버릭,말이 필요없습니다. 영화관가서 보세요!,10
탑건: 매버릭,탐크루즈 완전 멋지고스토리가 완전 감동입니다,10
룸 쉐어링,오랜만에 본 감동 잔잔한 영화,10
탑건: 매버릭,초반 서사에서 조큼 졸뻔 했지만  백미는 중후반이다  후반  뻔한 미군 국뽕 스토리이긴 하지만 남자에 가슴을 울컥하게 만들었다  재미있다 봐도 후회 안한다  극장으로 ㄱ ㄱ,10
탑건: 매버릭,톰크루즈 는 우리를 실망시키지 않는다,10
듄,최악  36세 인생 에 잇어서 보다가 나온영화는최초 . 와이프는 자버림,1
감동주의보,감동있게  봤읍니다  연기자님들 스탭님 감독님  수고하셨습니다,10
데드락: 라스트 리벤지,그냥 쓰..레...기리그래도 부르스윌리수짱,1
탑건: 매버릭,코시국을 날려주는 영화...!!,10
탑건: 매버릭,4dx로 봐야함..ㄹㅇ,10
탑건: 매버릭,그냥 속편스럽다톰크루즈는 여전히 개쩔고,7
닥터 스트레인지: 대혼돈의 멀티버스,재미있다완다 죽음슬픔,8
탑건: 매버릭,"스토리, 액션, 감동 3박자를 고루 갖춘 역대급 영화. 진짜 오랜만에 영화 같은 영화를 봤네요. 또 보고 싶어지는 최고의 영화!",10
버즈 라이트이어,버즈 너무 반가웠습니다. 우디도 한번 다시 만났으면 좋겠네요.,9
탑건: 매버릭,89년생으로 탑건 1은 그리 재미있다고 느끼지 못했으나 탑건 매버릭은 뭐하나 아쉬운 것 없이 좋았습니다,10
탑건: 매버릭,처음으로 평점을 써봅니다. 만점.,10
미래를 걷는 소녀,미래의 알 수 없음이 어떻게 보면 무한한 가능성의 장점을 가지고 있지 않는가,9
몸 값,이유있는 소름ㅋㅋㅋㅋ,10
탑건: 매버릭,높아지는 중력가속도와 함께 내 숨도 막힘,10
마녀(魔女) Part2. The Other One,예고편이 다인 상업용 영화 쓸데없이 영상시간도 김,2
탑건: 매버릭,생전 처음 평점을 올려본다 10점그이상이건 100 인찌 티비도 안된다 오로지 대형 스크린에서만 찐을 느낄수 있는 리얼  스크린 무비임,10
탑건: 매버릭,역시 믿보배 톰크루즈.,10
버즈 라이트이어,토이스토리의 버즈의 목소리가 크리스에반스라서 더 좋았습니다,7
탑건: 매버릭,액션도 좋지만 탑건도 너무 심장이 쫄깃거리고 스릴 있네요,10
범죄도시2,"강한펀치 귀여운 형사 마블리 무섭지만 매력적인 범죄자 구씨 강해상, 아주 재밌었습니다!",10
마녀(魔女) Part2. The Other One,3편이 너무 기대됩니다,10
탑건: 매버릭,이게 영화지 이런 영화입니다. 재미 감동 액션 최고예요.,10
탑건: 매버릭,그냥 미쳐버렸다 올해 개봉작 중 제일 만족도 높음,10
마녀(魔女) Part2. The Other One,전 1편 극장에서 보고 소재가 신선해 2편도 응원차 방금 극장서 보고 왔는데 화려하고 재미있었습니다 3편도 기대하고 있겠습니다 더 잔인하고 화려했으면 좋겠습니다,10
프릭스,어렸을 때 진짜 재밌게 봄,9
탑건: 매버릭,시작부터 기대감에 아드레날린 작렬!톰크루즈 아니면 절대 나오지못할 영화네요전편 리뷰보고 가서 오마주한 장면이나 인물관계 이해하면서 보길 추천합니다 알고보니 더 재미나요 역대급으로 연기 연출 몰입감 넘치는 영상 액션! 끝까지 지루할틈 없었어요bb 존잼 추천합니다,10
탑건: 매버릭,미국 영화가 왜 사람들에게 인기가 있는 지를 명확하게 알려주고 있다. 그동안 자기관리에 철저했던 톰 크루즈의 인생 깊이가 느껴진다. 영화를 보면서 다시 보고 싶다는 생각을 내내 했다. 영화관을 대체할 그 무언가가 언젠가는 나타나겠지만 아직은 아니다.,10
탑건: 매버릭,그냥 가서 보세요.  후회 안해요.,10
탑건: 매버릭,최고다 진짜 몸소 영화를 보며 느껴보길 바란다.,10
탑건: 매버릭,진짜!!!이건 꼭 극장에서 봐야 한다!!!,9
탑건: 매버릭,수능시험 보기전 기출문제 열심히 풀었는데 정작 시험당일에는 모르는문제 투성이라 어떻게든 시험푸는것같음,10
브로커,인간과 가족에 대한 고레에다 히로카즈 감독의 이야기는 계속된다.,7
탑건: 매버릭,"엄마랑 같이 보러 갔는데, 진짜 재밌어요ㅠㅠ 재미 감동 스릴 전부 다 있어요. 집에 가서 탑건 1 보려고요. 톰아저씨 계속 영화해주세요~~",10
탑건: 매버릭,무조건 영화관에서 보셔야 합니다.정말 재밌습니다.,10
명량,"억지 신파와 납득이 가지 않는 인물등장, 억지 스토리 전개 역사를 좋아하는 사람으로서 아쉬움이 큰 영화... 화가 난다",2
이상한 나라의 수학자,어릴적 수학에 빠쪘던 시절 생각도나고.. 극중 보람은 이상형..후반부 스토리텔링은 좀 아쉽다..,8
탑건: 매버릭,저 오늘보고 다음주에 4D로 다시 볼려고요 무조건 감명 감동 재미있습니다  꼭보세요 두번보세요,10
범죄도시2,1 보다는 약간 들 잔인하면서 코미디에 조금 집중한 느낌. 오랜만에 영화관에서 많이 웃고 갈 수 있었음 ㅋㅋㅋ 3편은 무조건 성공함,10
탑건: 매버릭,최고의 영화입니다. 좋은 영화 볼 수 있게 해주셔서 감사합니다.,10
범죄도시2,마동석이 이 영화의 장르다,7
탑건: 매버릭,탄탄한 스토리와 배우들의 연기오랜만에 너무 재밌게 봤어요 !,10
닥터 스트레인지: 대혼돈의 멀티버스,닥터스트레인지와 완다의 연기대결 영화,8
마녀(魔女) Part2. The Other One,3편 기대됩니다 ㅎㅎㅎ전 재밌었는데 재미없다는 사람들도 있어서 아쉽네요 ㅠ저는 시간가는 줄 모르고 봤습니다 ㅎㅎㅎ,10
범죄도시2,재밌네요 진심 최고네요 댓글알바아님,10
마녀(魔女) Part2. The Other One,전 괜춘한데요 평점이 왜 낮죠?사람들 수준이 많이 높은가 봐욤잼잇엇습니다,10
탑건: 매버릭,말이 필요없어..그냥 극장 가서봐..후회안할거야,10
탑건: 매버릭,36년의 기다림이 헛되지 않았다!,10
마녀(魔女) Part2. The Other One,잘 봤습니다재미있어요,10
탑건: 매버릭,사람에 관해서나 작품에 관해서나 세월이 흐른 후에도 이토록 멋질 수만 있다면!,8
마녀(魔女) Part2. The Other One,배우들 연기 액션 모두 최고 재밌고 웃겨요,10
탑건: 매버릭,걍 보세요걍 보세요걍 보세요,10
탑건: 매버릭,탑건1편 유튜브에서 줄거리 요약편보고 가세요.좀 도움이 돼요.^^아버지와 함께 가세요. 너무 좋아 하세요.초반에 대단.  마지막 전투기씬은 예상을 뒤엎고 더욱 푸짐한 영상을 보여줍니다.아무튼 너무 흥미진진합니다.최고예요.~^^ 전투기는 못 타지만오토바이는 탈 수 있어서 다행이네요 ㅎㅎ,10
마녀(魔女) Part2. The Other One,1보고 2나오길 목빠지게 기다렸는데 너무재밌네요. 3도 빨리 개봉해주시길,10
마녀(魔女) Part2. The Other One,정말 저 별점 잘 안 주는데ㅠ 제가 1보고 제일 기대했던 영화에요ㅠ 첨엔 음? 이게 뭔 내용이지 이랬는데 뒤로 액션신 나오는게 완전 쩔고ㅠ 토우 연기하시는 배우분들 섭외 잘 하신것 같아요 캐릭터가 잘 맞아서 몰입감 좋아여,10
위플래쉬,결국 모든 발전 그리고 진화의 출발점은 악. 온실 속 화초는 더 이상 성장하지 않는법.,10
탑건: 매버릭,와 낼 또보러간다 연기 연출력 음향 긴장감 모두만족,10
탑건: 매버릭,&amp;#34;내가 탑건이야. 탑건은 나야!&amp;#34; 최근 드라마 히트대사에 대입해봤습니다. 영화 정말 gooood~~~~,10
탑건: 매버릭,"인간이라면. 무엇보다 아재라면. 느낄수 있는 모든 전율, 소름과 벅차오름을 아주 탈탈 털어서 폭발시키는 영화입니다. 무조건 영화관에서, 가급적 아이맥스로, 더 가급적이면 4dx로 보세요. 탐형 만수무강하세요.",10
마녀(魔女) Part2. The Other One,그냥 배우들이 다 너무 매력적이에요 짜릿해,10
탑건: 매버릭,매순간 보는것만으로도 감동이었습니다,10
마녀(魔女) Part2. The Other One,"3화 예고편 느낌,, 영화 보다가 하품만 몇번 한 지 모르겠네요,, 그래도 다음 편은 김다미 때문에 재미있을거 같긴해요 ㅎㅎ,,",4
탑건: 매버릭,미쳤다  이것이 진정한 헐리우드 영화,10
탑건: 매버릭,너무 재밌어서 또 보고싶어요,10
탑건: 매버릭,톰 크루즈가 숨을 참으면 나도 함께 숨을 참게 되는 놀라운 몰입감. 어쩌면 스크린은 불멸의 존재가 아닐까 생각이 든다.,10
탑건: 매버릭,처음으로 남긴다..존잼,10
탑건: 매버릭,올해의 영화!!! 그냥 재미있는 영화입니다,8
탑건: 매버릭,감동과 재미와 몰입감 등등  모든걸 다잡은근4-5년 이래 개봉한 영화중  단연 최고라고 생각함 ㅠ  너무너무너무너무 재미있었다,10
범죄도시2,재미있게 보았어요,10
탑건: 매버릭,속편은 탑건2처럼 전작에 대한 예우가 있어야함. 전작 다 개무시하고 만들거면 만들지 말라고 ㄷㅈㄴ 니네 말하는거다,10
마녀(魔女) Part2. The Other One,저는 재밌게 봤어요 2번 봤습니다 쿠키 영상 꼭 보세요,10
그대가 조국,ㅋㅋㅋ이런걸.. 왜?,1
탑건: 매버릭,탐형 은  그냥 전설이다~~또본다~~,10
탑건: 매버릭,"아이맥스로 봤는데 정말 지리고 지렸습니다... 톰형 대단한건 말할것도 없고, 미국형님들의 전투력과 이를 영화로 리얼하게 표현을 해내는게 정말 넘사벽입니다..  감동과 웃음도 있고 레알 최고의 영화였음",10
탑건: 매버릭,마지막 눈물 찔끔~~^^,10
탑건: 매버릭,"감동요소, 재미요소 다잡음 진짜 역대급으로 너무 재밌었어요!!",10
첨밀밀,어릴땐 잘 몰랐었는데 30대후반이 되어서야 예전에 유명했던 홍콩영화들의 진가를 알게 되는것 같다...지금봐도 명작인 명작...,10
브로커,많은 의미를 담은 너무 좋은 영화였습니다상영관이 적어서 아쉽네요,10
탑건: 매버릭,탑건1을   보시고  매버릭을 보면  더 이해가 잘됩니다!  1 보다  더  잘만들었네!^^,10
탑건: 매버릭,긴말 필요없음. 만점임. 역대급임,10
니얼굴,영화보는 내내 웃음이 떠나지않고 은혜씨는참 사랑이 많은 사람이구나 생각드는 영화?,10
탑건: 매버릭,너무 재밌고 감동적이에요 강추합니다,10
탑건: 매버릭,근래 본 영화중 최고였음. 레트로하면서도 세련된 연출이 압권!,10
탑건: 매버릭,낼모레 50인데 평점 처음 남깁니다.아이맥스 보려고 차 한참타고 가서 본 보람 있어요.공중전씬 멋있어요.35년동안의 톰크루즈 인생 일대를 본 느낌..,10
탑건: 매버릭,좋았다ㅡ메버릭 그런 표정 짓지마!,10
탑건: 매버릭,말이 필요없습니다. 그냥 보세요.,10
브로커,재미와 감동이 있어요 전 이 영화 강추입니다보통상받은 영화 어려운데 이 영화는 재밌게 볼 수 있고 명품배우들도 많아 강춥니다,10
탑건: 매버릭,톰크루즈는 명불허전 명배우다. 나이가 60이 넘어도 모든 연기를 소화해내는 부분이 대단하고 영화의 영상미나 재미는 전작을 뛰어넘는 이번 영화는 한동안 남을 명작이 될듯..,10
아홉살 인생,국민학교때 많이 좋아했던 선미가 생각난다.,7
탑건: 매버릭,와~대단하다~정말~~,10
범죄도시2,너무재밌게봤음 또보고싶음,10
탑건: 매버릭,레전드입니다 꼭 보세요,10
탑건: 매버릭,역시 전설적인 탑건전투기씬 넘 멋져요.영상미도 좋구요. 영화관에서 꼭 봐야함.영화 중간 중간 나오는 배경음악도 좋네요.,9
탑건: 매버릭,재밌음,10
마녀(魔女) Part2. The Other One,"별점 1점도 아깝다 갑자기 중국애들은 왜 나오는거며, 대사는 욕 범벅에 액션은 어디서 본 듯한 기시감 뿐임 사실 내용에 개연성이 있으면 다 상관없었을텐데 왜 복수를 하는지 설득력이 부족해서 나중에 액션 장면이 나와도 심드렁함 한국에서 이런 시리즈물이 나온다는 것 자체는 큰 의미가 있을 수도 있겠으나… 재미는 없음",1
스파이더맨: 노 웨이 홈,"마블영화 별로 안좋아하는데, 가슴이 웅장했습니다.",10
탑건: 매버릭,영화 미쳤당  이런영화 다시나올수있을까~~,10
쓰리: 아직 끝나지 않았다,내가 영화 보는 눈이 없다보다. 어디서 긴장감을 느껴야하는지도 모르겠고.. 유수 영화제에서 극찬을 받았으나 난 이 영화를 보는 시간이 아까웠다.. 실제 연기자들인지 궁금할 정도로..,3
탑건: 매버릭,와... 진짜 이거는 와.. 와 먹어야겠다,10
탑건: 매버릭,아... 탐크루즈는 살아있는 전설이다. 영화도 불편한 구석 없이 흥미진진 감동 재미 그 자체!! 항공액션 대박!!! 존경합니다 모든 제작자분들 그리고 탐형,10
탑건: 매버릭,돈 띵 저스트 두 잇… 생각하지말고 걍 봐야함 지리는 영화,10
탑건: 매버릭,"명불허전 탐크루즈~~ 폭력성,선정성,잔혹성 제로~~영상미 뛰어나서 몰입도가 대단하네요.",10
탑건: 매버릭,"스토리 , 연출 하나 빠지는 거 없이 훌륭햇다... 완전 최고.. 안보면 후회할만한 영화이다",10
탑건: 매버릭,"너무 재밌음, 톰크루즈 짱",10
마녀(魔女) Part2. The Other One,마지막 10분 짜리만 보여주면 되는 영화...질질 끄는 동안의 시간이..따분해서 죽을뻔..히어로 물이라고 생각하며 감안해도...1편과 중복되는 소재에 지루함은 물론인데..웃으라고 짠 포인트의 개그코드들은 어쩜 하나같이 오그라들어서 보기 힘들었음...웃는 사람이 있을까싶음...,2
마녀(魔女) Part2. The Other One,기대를 너무했나봅니다,6
탑건: 매버릭,감동 쩌네요 말이 필요없음,10
탑건: 매버릭,"진짜 상상이상의 영화 , 이쯤이면 감동이다 싶었는데 한계을 몇번을 돌파하는지 모르겠어요",10
탑건: 매버릭,마지막 전투씬을 향한 여정. 잘따라오다보면 해일 일듯이 몰아치는 긴장감과 스릴을 즐길수있음. 헐리우드와 톰크루즈의 위대함을 다시한번 느낍니다.,9
탑건: 매버릭,꼭 꼭 꼭 보세요 이건 정말 명 작 입니다,10
탑건: 매버릭,전투기 공중씬 역대급 최고!,10
탑건: 매버릭,진짜 오랜만에 소름돋게 재밌는 영화봤네요톰크루즈 포레버,10
탑건: 매버릭,마지막 20분 동안 몰아침 와...,10
탑건: 매버릭,말이 필요 없다.. 전율 그 자체,10
닥터 스트레인지: 대혼돈의 멀티버스,주인공 완다 아닌가요?,8
탑건: 매버릭,재미있어요굿굿굿Good,10
탑건: 매버릭,영화들 중 상위 1%의 영화를 탑건이라 한다,10
탑건: 매버릭,개인적으로 엔드게임에서 느낀 전율 급,10
브로커,얼마나 지루하면 중간에 사람들이 계속 나감… 소극장이라 사람이 없는데도 이러면 ㅠ 나도 중간에 나옴ㅋㅋ 이 이야기를 잘 풀어냈으면 괜찮을 지도 모르겠는데 그냥 감동도 재미도 없었음,1
탑건: 매버릭,노래도 존나좋고 초반에 피아노치고 단체로 노래하는 부분이 너무 좋았음 미필인데 나도 공군 가고싶다,10
탑건: 매버릭,너무 재밌어요. 감동 재미 액션 다 있어요!!! ㅇ강추,10
탑건: 매버릭,그냥 닥치고 지금이라도 봐 15000원 줘도 안아깝다,10
탑건: 매버릭,1편보다 더 완벽한 후속작.탑건의 완벽한 귀환극장에 꼭 가야 하는 이유,10
탑건: 매버릭,탑건 2 꼭 보세요! 파일럿 영화중 젤 재밌었음,10
탑건: 매버릭,말이 필요없다. 그냥 개간지다. 남자의 심장을 진동시키네.,10
극장판 윌벤져스 : 수상한 캠핑 대소동,한국애니메이션에 미래가 밝네요^^좋은시간이였습니다.,10
탑건: 매버릭,존잼이다 진짜 역대급이었음,10
탑건: 매버릭,이게 영화아닙니까!!!,10
극장판 윌벤져스 : 수상한 캠핑 대소동,오랜만에  동심의 세계로 돌아갔네요즐겁게 잘봤습니다^^,10
탑건: 매버릭,누가봐도 재밌을 영화 스트레스 풀림,9
탑건: 매버릭,와  명작입니다저도 이런거 처음 쓰는데 진짜박수치고 싶었어요.몰입도 작품성 연기력  연출 다 만점 주고싶네요,10
탑건: 매버릭,이게 헐리우드 영화지...,10
범죄도시2,1편에 비해 악당이 카리스마가 없음. 1편과 차별화된 얘기도 없고.,1
버즈 라이트이어,고학년 남자아이 정도가 좋아요~ 저학년 여자아이들은 중간에 나갑니다~ 전체 스토리는 뭐~ 근데 디테일한 스토리는 완전 고구마~ 과도한 실수로 인해 웃긴게 아니라 짜증남~,4
