movie,sentence,score
탑건: 매버릭,톰 크루즈의 내면 갈등이 인상적이었고 그런 것들을 뛰어난 액션과 어울려 자연스럽게 풀어내는 스토리와 연출에 감탄했다. 중국시장을 거르면서 개봉한 이유가 다 있었다. 톰  형님 스크린에서 오래오래 보고싶다. 요 근래 본 해외영화 중 가장 뛰어난 수작이다.,10
탑건: 매버릭,미군과 헐리우드만이 만들 수 있는 영화.탑건 1보단 나은 2편 .코로나 터진 이후로 최고 대작.또 봐야지!!,10
탑건: 매버릭,평점 처음 줘봅니다!!!,10
탑건: 매버릭,"웬만해서는 추천 리뷰 안남기는데, 정말 처음 남겨봅니다. 꼭 보고 오세요",10
탑건: 매버릭,"영화가 끝난 후 박수치는 관객들, 땀이 흥건.톰크루즈의 영원한 매력, 향수를 불러일으키는 OST  모든것이 완벽했어요",10
버즈 라이트이어,"지루함, 중간중간 캐릭터 발암..",6
브로커,"시간,돈 배우들. 너무너무아깝다",2
마녀(魔女) Part2. The Other One,"뭐랄까.. 마감 시간은 정해졌고 아직 만들어 놓은건 없고 급하게 찍어다 일단 올려논 작품 같다는 느낌.. 대체적으로 다 어색해요 연기, 연출, 연계도 스토리도 아쉬움만 남습니다 1편 재밌게 보고 기대 꽤 했었던 2편인데 2시간 30분 가까이 런닝을 1시간 30분 으로도 충분히 줄일수 있겠다 싶고 줄였으면 차라리 나았을 영화",1
탑건: 매버릭,보고온 저녁에 영화가 계속머릿속에 맴돌아서 다음날한번더봄,10
그대가 조국,올해봤던 최고의 영화다들 한번씩 봤으면 좋겠습니다,10
마녀(魔女) Part2. The Other One,1편을 보고 보면 재밌음 다 필요없고 그냥 3편이 기대가 됨!!,10
탑건: 매버릭,미쳐버림 한 번보지 말고 여러번 봐야함솔직히 처음에 스토리 어떻게 풀어갈지 좀 걱정됐는데 너무 잘만듬 내일 또 볼거임,10
탑건: 매버릭,1편 안보고 가도 충분히 재밌어요. 정말 공중전투씬만 하더라도 너무 재미있게 봤습니다. ㅎㅎ,10
탑건: 매버릭,기대안했는데 와우!! 손에 땀을 쥐네욤,10
어우동: 주인 없는 꽃,쓰래기 영화임 여배우 연기가 너무합니다,2
스윗 프랑세즈,남여주연의 섬세한 연기와 전쟁중에도 피어나는 러브스토리가 애절함,9
탑건: 매버릭,리뷰같은거 잘 안쓰는데 탑건은 안쓸수가 없네요. 감동과 재미를 모두 잡은 수작입니다.,10
마녀(魔女) Part2. The Other One,1편의 내용이 반복이라 2편 건너뛰고3편 봐도 상관 없을 듯.대사의 시작이 거의 X발임.시원한 에어컨 바람 쐬면서 2시간 잘 잠.굳이 2편을 제작했어야했나 싶음.,1
탑건: 매버릭,루스터를 보면 헤리케인이 생각남 ㅋㅋㅋ,10
마녀(魔女) Part2. The Other One,3편을 안볼수 없도록 만드셨네요,6
탑건: 매버릭,지렸다 댓글 처음 남겨봐요,10
진주만,퐁퐁남 시대의 서막을 알리는 영화였네...,2
탑건: 매버릭,감동 재미 둘 다 잡은 영화! 큰 기대 안 했지만 너무 재밌음 ㅋ_ㅋ 비행액션?씬이 너무 멋지다,10
탑건: 매버릭,탑건 1편은 안봐서 기대를 안해서인지 매우 재밌게 잘 봤습니다. 손에 땀을 쥐고 봤네요.,10
탑건: 매버릭,명대사도 많고 감동입니다~ 1편 전날 보고 가서 더 감정이입이 되더라고요~ 보고나와서 알게되었는데 cg가 아니고 대부분 직접 찍은거라니 더 대단하네요~,10
마녀(魔女) Part2. The Other One,그냥 최선을 다해서 봤음,1
탑건: 매버릭,이게 영화고 이게 톰 크루즈다,10
원더풀 고스트,마동석 팬이지만 평점은 팬이 아닌 척,5
탑건: 매버릭,"대박,대박,감동,초감동  최근 몇년사이 최고의 영화역시 톰크루즈 엉클",10
닥터 스트레인지: 대혼돈의 멀티버스,대환장의 호러버스네. 왜 닥터스트레인지를 B급호러무비로 만들고 난리...,4
탑건: 매버릭,태어나서 평점 처음써봄 진짜최고,10
탑건: 매버릭,정말 잘 만든 영화. 큰 기대 안했는데 재미있었음!,10
마녀(魔女) Part2. The Other One,영상미 액션 좋음 스토리가 조금 늘어짐 3편을 위한 영화..구자윤 김다미와 함께하는 3편이 기대됨,8
탑건: 매버릭,오랜만에 본 찡 잼남. 강추,10
영웅: 천하의 시작,새생명들을 위한 하나의 시작점. 과거의 복수 보단 미래로 의 희생을 선택한 한 영웅의 이야기.,8
탑건: 매버릭,말이필요없는 최고의 명작..,10
룸 쉐어링,여러가지 사회 문제를 생각하게 하는 감동적인 영화였어요. 배우들의 연기도 너무 좋았어요.^^,9
탑건: 매버릭,말이 필요 없습니다.,10
니 부모 얼굴이 보고 싶다,"스토리와 연출 능력이 참 허술하다... 결말에 충격을 주고 싶었다면 영화 진행하는동안 설경구 자식도 똑같은 피해자처럼.. 어쩔 수 없이 방관했던것처럼 연출했어야 됐는데, 방관자라고 하기엔 이미 밝혀진 사실들만으로도 설경구 자식은 충분히 가해자에 가까워져 있었음. 물론 설경구는 진실을 몰라서 눈물을 흘렸을 수 있겠지만 관객들은 이미 설경구 아들이 한 짓을 알고있는 상태이기 때문에 드론 속 영상에 딱히 임팩트는 없었음.그리고 문소리는 연기력이 왜 이렇게 쇠퇴했냐.. 초반에 아들 죽어서 우는 연기할때마다 쥐어짜는데도 눈물이 한 방울도 안 나오더라... 천우희는 주인공인데 후반부에는 아예 존재감도 없어지고... 여러모로 기대이하.. 감독 얼굴이 보고 싶다...",6
탑건: 매버릭,이게 왜 이리 평점이 높은지 모르겠지만 러닝타임이 2시간 10분 이였고초중반 지루하고 미국 공군 드라마 느낌이였고마지막 30분이 제일 짜릿하고 감동적이였음.역시 톰이 톰했다.아무래도 1탄 스토리 이어야해서 조금 클래식한 느낌이 많은 영화,8
탑건: 매버릭,첫장면부터 왜 눈물이나오냐 ㅠㅠㅠ 꼭 아이맥스가서 보세요.,10
범죄도시2,너무 재밌었어요 잔인하기한데 웃긴 부분도 많구요 손석구 보려고 간건데 또 보고싶을만큼 전체적으로 좋았습니다,10
탑건: 매버릭,모든것이 완벽했습니다,10
탑건: 매버릭,좔영할 때 실제 전투기에 탑승하여 기동하면서 촬영했다는 것이 실감되는 것이...배우들이 전투기가 고기동간에 몸이 움직이며 얼굴이 실제로 일그러지며 G압력을 견디는 씬에...나도 모르게 같이 짧은 호흡을 하게 만드는 장면이 압도적이다.  나도모르게 주먹을 쥐고 성공하기를 기원한다고 해야 할까?....무튼 내가 몰입된다. 아직도 톰형이 보고싶다.,10
베스트 오브 미,정말 감동적이네요 마지막엔 눈물이…인생에 대한 가치와 사랑의 의미에 대해 표현하기 어려운 공감을 느낌 작품입니다 우리는 다 같은 세상을 살아가지만 서로 다른 시간을 살고 있는게 아닐까 싶어요 좋은 영화로 강추입니다,10
탑건: 매버릭,1편은 선택이 아니라 필수 팬서비스나 전작에 대한 예의가 상당하다,10
탑건: 매버릭,"제가 원래 평점 잘 안매기는데, 이 영화가 제 처음 평점 영화에요! 너무너무 재미있게 잘봤고 10전 만점 안주기 너무 아까운 영화에요! 진짜 행복하고 스릴있게 봤습니다!!!! 꼭한번 봐보시길 추천드릴게요!&amp;gt;&amp;lt;",10
탑건: 매버릭,배우들의 나이듦이 씁쓸하긴했지만 최근본영화 중 최고였습니다. 톰크루즈씨 오래오래 멋진모습보여주세요 좋은영화감사합니다.,10
탑건: 매버릭,"다분히 미국적인 90년대 올드한 전개, 영상인데 전혀 지루하지도 촌스럽지도 않음. 역지 톰형이고 그의 열정이 있기에 가능한 수작으로 눈호강과 감동 선사에 경의를 표함. 하나 아쉬운 점은 톰형이 많이 늙어 이제 그의 작품을 앞으로 얼마나 볼 수 있을까 하는 것임.",10
닥터 스트레인지: 대혼돈의 멀티버스,"나는 삐급 영화의 갬성이 좋은데, 이 감독은 내 취향인듯 ㅎㅎ 괜히 경쾌한 문어 눈깔 빠지는 소리 등..이블데드 느낌으로 혼자 웃으며 본듯 진지한 배우들에 진지하지 않은 연출 암튼 나는 또 보고 또 봄",10
탑건: 매버릭,그냥 최고의 영상입니다,10
탑건: 매버릭,이거 처음달아봐요 말이필요없는 10점이요,10
네번의 결혼식과 한번의 장례식,재미 있고 배우들도 참 좋고 영국적 분위기와 색감이 좋은 영화인데 좋은 내용은 절대 아니다. 공감도 안된다. 중독성 있지만 보고 나면 개운치 못한 영화. 확실히 호불호 갈리는 영화이고 혼자 보는 게 재미 있을 영화. 그리고 휴 그랜트 너무 찌질하고 병신 같다.,8
탑건: 매버릭,말이 필요없음 최고의 영화,10
탑건: 매버릭,간만에 영화 재밌게봤네요클리셰 많은 뻔한줄거리지만 재밌으면 그만,10
버즈 라이트이어,아주 재미있었습니다 강추!!! 우주를 좋아한다면 추천!,10
조커,이 영화에 1점을 준 사람들은 기득권층일 것이다. 마지막에 말해도 이해 못 할 거라며 노래 가사를 읊조리며 노래가 흘러 나오는 장면은 희대의 명장면. 희비가 모두 담긴 명장면.,10
탑건: 매버릭,22년 최고의 영화는 탑건~ 3번째 관람이며 지인도 모시고 봤습니다 영화 마지막 장면들은 가슴을 뭉클하게 하면서 제 삶 속에서 교훈을 주기도 합니다 스토리를 떠나서 두번 다시 나오기 힘든 이런 영화를 제작하고 목숨걸고 연기한 영화배우 &amp;#39;톰 크루즈&amp;#39;님 한테 경의를 표하며 너무 감사합니다~나이도 있으신데 몸 건강하시길 바랍니다.,10
탑건: 매버릭,다시 봐야겠네요.. !!!  쵝오의 영화.,10
탑건: 매버릭,아 간만에 영화다운 영화 본듯,10
탑건: 매버릭,진짜 남자의 영화다굉장히 재밌어 ㅠㅠ 정말,10
탑건: 매버릭,역쉬 베스트 오브 베스트!또 보고싶은 영화입니다!,10
범죄도시2,범죄 액션물을 좋아한다면 만족할 만한 작품. 잔인한 장면이 많은 편이니 주의. 스토리도 나쁘진 않았다.,10
탑건: 매버릭,진짜 멋지고 재밌어요.,10
탑건: 매버릭,톰 크루즈 만수무강 하십쇼,8
탑건: 매버릭,아이맥스로 다시 보기위해 예매했어요웅장한 사운드와 돈을 아끼지 않은듯한 비행액션은 정말 대박입니다 만약 보싥꺼면 아이맥스 추천이요,10
탑건: 매버릭,스토리상 있어야하는 진지한 부분마다 자연스러운 연출과 각본 센스가 좋았다. 또한 영화관의 넓은 스크린이 비행씬의 속도감을 더 잘 전달해주었다.,10
탑건: 매버릭,영화관이 있는 이유 이런 영화 보라고 있는곳임,10
아이 씨 유,기분나쁘고 억지스런 스토리에 전체적으로 조금 루즈함,4
반지의 제왕: 왕의 귀환,"영화관에서 본지가 10년이 넘었는데, 그 웅장함이 지금까지도 기억이 나네요.드라마 반지의제왕도 기다려집니다.",10
탑건: 매버릭,옛날 감성이 느껴지며 정말 웅장하고 멋진 최고의 영화입니다,10
탑건: 매버릭,1초도 버릴 게 없는 영화. 너무 재미있고 또 보고 싶다.,10
탑건: 매버릭,매버릭 얼굴만 봐도 즐거운 영화.모든 것이 완벽했다. 최고다.,10
탑건: 매버릭,이 시대 최대의 감동!이 것이 극장에서 보는 재미다.,10
탑건: 매버릭,크루즈형은 나이를 거꾸로 먹음?자기관리 대단한듯...영화 추천 추천 또 추천!,10
탑건: 매버릭,살면서 평점 처음 달아봄. 반드시 만점을 줘야될것 같아서. 톰 크루즈와 동시대를 살고 그의 작품을 볼 있다는 것이 영광이었다는말밖에 할 말이 없음. 진심으로 리스펙.,10
브로커,감동도 있고 여운도 있습니다,10
탑건: 매버릭,이건 4dx로 꼭 보세요,10
탑건: 매버릭,오랜만에 영화같은 영화.극장가서 봐야하는 영화 봄행복합니다,10
뉴스 오브 더 월드,톰 행크스의 눈빛에 지리고야 말았다,10
탑건: 매버릭,"인생 최고의 영화 ,, 액션씬 에서는 다리에 힘 들어가고 숨도 막힙니다 ㅋㅋㅋ 대박이에요",10
탑건: 매버릭,이게 후기가 될런지 몰겠지만...여러분...  F14톰캣이 등장합니다...감격.. 흑흑...,10
그대가 조국,뭔가 아쉽다. 그내가 조국,10
탑건: 매버릭,난생처음으로 평점을 직접 주고 싶게 한 영화에요. 36년 만에 나왔는데 이리 기대이상의 감동을 주다니.. 정말 강추해요!!,10
마녀(魔女) Part2. The Other One,이딴게 영화? 이런걸 연기 시켰는데 하는 배우들이 대단,1
그대가 조국,하.. 어우 ㅋㅋㅋ..ㅋㅋ,1
탑건: 매버릭,와 너무 잼있고 감동 줄줄~~ 개봉 기간 내 또 보러 갈 듯 하네요!!,10
탑건: 매버릭,원작이 인기가 너무 크면 기대이하이기 마련이데.. 그런 상식을 깬 인생작 중 하나,10
범죄도시2,유치 찬란?졸작중에 졸작?영화본 시간이 너무 아까워요ㅜㅜ단지 제가본 느낌을 그대로 전합니다,2
탑건: 매버릭,올해최고의영화~^^,10
마녀(魔女) Part2. The Other One,아직은 스토리를 펼쳐놓는 중 인듯..,8
탑건: 매버릭,영화관용 영화란 무엇인가,10
탑건: 매버릭,말로 표현을 할 수가 없다.1편까지 다시보게 하는 정말 최고의 영화!!!또 보러 갈거고..IPTV에 나오면 소장할거임.,10
닥터 스트레인지: 대혼돈의 멀티버스,"오랜만에, 집에서 보다가 껐다..",3
탑건: 매버릭,IMAX같은 특별관이 존재하는 이유를 보여주는 영화.,10
탑건: 매버릭,말이 필요없는 레전드의 귀환 탑건 매버릭,10
탑건: 매버릭,"전투기씬이 시원 시원했다. 뭐니뭐니해도 여전히 건재한 탐크루즈를 보며 약간 뭉클했다.  나이듦을 멸시하는 세태에 전혀 밀리지 않는 백전노장의 연기에 감동하며, 용기마저 얻은 것 같은 기분이다.",10
탑건: 매버릭,벅차오르는 느낌 간만이었습니다,10
기도하는 남자,최욱씨  추천영화는  내 기준으로 5점 만점에 3점 정도. 기도하는~. 악마는~ 둘다 쏘쏘 정도. 넘기대 않고 봐야함다.,4
탑건: 매버릭,평점 만점 주러 왔다. 이런 영화가 또 나올 수 있을까,10
탑건: 매버릭,올해 최고의 영화.,10
스타워즈 에피소드 2 - 클론의 습격,클론전쟁을 낳아줘서 너무 고맙다,10
연애 빠진 로맨스,연기는 리얼해서 좋긴한데 여주 캐릭이 너무 OOO 같음 솔직한걸 넘어서 쌍스러워,6
탑건: 매버릭,진짜 최고입니다 영상 한장면 한장면이 너무 아름답고 이영화는 찐이구나 생각들었어요 다들 꼭꼭보세요 명작입니다극장에서 안보시면 후회할거예요,10
탑건: 매버릭,한번보고 끝낼 수 없다.,10
버즈 라이트이어,토이스토리를 보지않더라도 전해지는 감동,9
탑건: 매버릭,이건 꼭 영화관에서 두번 보세요안보면 안본 사람이 손해같음,10
탑건: 매버릭,2천만명 가자 탑건! 가자!!!,10
탑건: 매버릭,신랑 추천으로 30년만에 탑건1 어제보고 오늘 탑건2 봤어요꼭 탑건1 보고가세요~최고예요~꼭 영화관에서 봐야할 영화,10
닥터 스트레인지: 대혼돈의 멀티버스,왜 난 재밌던데 원더우먼2는 어떻고 것보다 훨씬 나음,8
탑건: 매버릭,처음남겨본다 탐크루즈 개멋있더라 역시,10
그대가 조국,할 말이 없다 조국의 일대기,1
마녀(魔女) Part2. The Other One,평점 제일 낮은것만 골라서 봐라. 그러면 발전 할 수 있다. 높은 평점 내용은 아무 의미 없다. 까는 이유를 잘 분석하면 그 안에 답이 있다. 마녀 시리즈를 이렇게 나락으로 보내버려? 다음부턴 액션 찍겠다는 여배우 캐스팅 못할 수도 있다,2
마녀(魔女) Part2. The Other One,인물 내용 스토리 전계 이해불가 ...  그저 그냥  삼류보다도 떨어짐 ㅜㅜ,1
타짜: 원 아이드 잭,충분히 재밌는데 평이 박하네요.,10
탑건: 매버릭,갓킹 대박이었음?속이 펑툴림,10
탑건: 매버릭,"진짜 헐리우드 작정하고 만들면 이런상업영화 아직도 만들수 있는걸 보여준 영화, 소재떨어져서 마블영화만 나오던중에 단비처럼 나온 최고의 클리세, 아이맥스 카메라를 극치로 만든 항공기씬과 탑건 올드펜 오마쥬까지 각본이 너무 완벽함 군더더기 없이 두시간이 시간가는줄 몰랐음 양놈들이 영화는 잘만듬 마블말고 이런 헐리웃 전성기시절 영화가 또 나왔으면 한다",10
탑건: 매버릭,꼭 보세요 안보면 후회합니다,10
탑건: 매버릭,진짜 너무 재밌음.  이건 꼭 봐야함! 톰 크루즈는 말할것도 없고 나오는 애들 다 멋있음ㅠㅠ별 10점도 부족한 영화인듯,10
탑건: 매버릭,"80년대에 탑건1을 보지않고 저번주에 봤는데도 시작할 때 가슴이 뭉클했고 미국인이 아닌데도 미군에 입대하고 싶었다. 영화가 주는 유희는 탑건 1과 90%이상 일치하고(세월과 기술이 더해졌을 뿐 거의 똑같은 영화라고 봐도 무방하지 않을지?)  어떻게 이렇게 재미있을 수 있는지 신기할지경. 김창완이 늙어서도 뛰는 가슴을 가지고 있을까봐 겁이난다고 했고 늙어서 본인이 아직도 젊은 줄 아는 아재들 굉장히 별로인데 톰크루즈는 예외인것 같다. 알파메일, 미국적 낭만의 정점",10
탑건: 매버릭,옛날 살던 동네에 놀러갔는데 30년전에도 있던 김치찌개 맛집이 아직도 있어서 먹었는데 인테리어는 바뀌었지만 그때 그 맛 그대로라 울컥함.,10
레드 노티스,6언더그라운드 를 예상하고 봤는데..차이가 나도 너무 난다...뭔가 많이 부족해 ...많이 빠져있어 ..개연성 도 없고 많이 허술 하고 ...90년대 영화 라면 ?OK 그러나 우리는 21세기에 살고 있습,6
탑건: 매버릭,진짜 너무 재미있어요 개꿀잼,10
감동주의보,재난 영화. 영화란 기본이 참 중요하구나를 느낌.  배우들이 투자한 시간이 아까움. 누군가의 시간과 에너지를 소중하게 생각하시길..,2
탑건: 매버릭,너무재밌고 너무잘만들었다,10
탑건: 매버릭,진짜 10점 만점에 100점 영화. 이 정도 만들어주면 2만원도 안 아깝다,10
탑건: 매버릭,너무재밋게 봤어요~!  1보고 가면 더좋을듯,10
하루,나보고이서 ㅎㅎㅎ125,10
탑건: 매버릭,올해 최고의 영화. 오랜만에 심장 뛴다. 뒤에 타고 싶어.,10
탑건: 매버릭,그냥 꼭 보세요!!! 그냥 보시면 압니다!!,10
탑건: 매버릭,너무 재밌게 봤음. 영화 끝나고 나오는데 바로 또 보고싶은 영화,10
탑건: 매버릭,방금  극장에서 보고 왔는데 최고네요   이런게  영화죠 맨날CG 로 싸우는 코믹스    액션 보다  진짜  영화를  보니 좋네요,10
범죄도시2,코믹요소를 일편보다 더 추가한듯,10
극장판 윌벤져스 : 수상한 캠핑 대소동,왜 디즈니 보는지 알수있음,2
탑건: 매버릭,진짜 요근래 들어 본것중 제일 완성도가 높습니다,10
탑건: 매버릭,근래 최고의 영화라고 자신있게 말함,10
탑건: 매버릭,간만에 초대작 클래식은 영원하다미국국뽕영화에 뻔한 스토리라도 좋다재미있다 역시 톰아저씨 인생작 다운 탑건또 보고싶네요,10
탑건: 매버릭,세상에는 두 부류의 사람이 있다.탑건을 이미 본 자와 이제 보려는 자.당신이 자랑스럽게 말할 수 있는 추억의 귀환.,10
탑건: 매버릭,말이 필요없음. 이 영화는 무조건 극장에서 봐야합니다 ^^b,10
탑건: 매버릭,근자에 본 영화중 가장 수작!!,10
탑건: 매버릭,말이 필요없음전작을 뛰어넘었다,10
탑건: 매버릭,그냥 미쳤어요 역대급 영화,10
탑건: 매버릭,조조로 보고왓는데 가족들다 재밋어햇음!!,10
탑건: 매버릭,스케일과 스토리 두마리 토끼를 다 잡았다,9
탑건: 매버릭,말이 필요없음 무조건 보세요.,10
해적: 도깨비 깃발,대체 한효주는 저런 연기력으로 왜 계속 영화나 드라마에서 써주는거냐...뭔 연줄이 대단한가,4
탑건: 매버릭,탑건1이 얼마나 대단한 영화인지 알겠다.. 특히음악,4
탑건: 매버릭,와~~~진짜 재밌습니다 강추,10
탑건: 매버릭,스토리 전개니 액션이니 뭐 하나 빠진거 없이 대박입니다,10
탑건: 매버릭,1편을 보고 보시면 더 몰입감이 높습니다. 앞으로 액션 드라마 영화로는 이 이상의 영화가 나올까요?,10
47미터 2,케이지안에 있으라고 제발 좀,6
47미터 2,케이지안에 있으라고 제발 좀,6
탑건: 매버릭,두시간 아드레날린 폭팔함. 분노의 질주 공중판,10
탑건: 매버릭,너무 감동적이게 잘 봤어요~^^1편을 꼭 보시고 2편보시면 좋아요~,10
탑건: 매버릭,시작부터 bgm듣고 두손두발 다 들었습니다요..1편 본 저같은 아재들은 감동 두배 일듯합니다.가히 역작이라 칭합니다 이런 작품을..,10
탑건: 매버릭,감동적이고 재미있었어요!,10
마녀(魔女) Part2. The Other One,액션은 최고다~~~초반 지루한것만 3탄에서는빼주길~10탄까지나오길바란다,10
탑건: 매버릭,나에게 인생영화가 된 영화,10
스포트라이트,탄탄한 구성과 잘짜인 스토리와 균형을 잃지 않은 가치,9
마녀(魔女) Part2. The Other One,나름 볼만했어요 지루하지 않았네요,8
탑건: 매버릭,어벤져스이후 처음 지렸다,10
그대가 조국,완전 구려 완전 구려  완전 구려,1
버즈 라이트이어,평이 안좋길래 기대 안하고 봤는데 예상외로 감동적이고 스토리 기승전결도 깔끔해서 좋았음. 영상미는 말할것도 없고.. 돌비시네마로 봐서 그런지 사운드 장난아니였음. 한번 더 보고 싶은 영화!,8
탑건: 매버릭,계속 보고 싶어요. 디즈니나 넷플릭스 같은데서 시리즈로 내주면 좋겠습니다.,10
장사리 : 잊혀진 영웅들,학도병 여러분 감사합니다,10
탑건: 매버릭,생애 처음으로 극장에서 2번 본 영화,10
탑건: 매버릭,30대 이상 감성이예요~,10
인생은 아름다워,남주인공 연기가 돋보이는 감동 웃음 ost 뭐 하나 빠지는게 없는 최고의 명작,10
탑건: 매버릭,"관심있던 장르가 아니라서 시즌 1도 안 본 상태로 별 기대 없이 지인과 함께 봤는데, 와 미친 이게 진짜 영화구나 싶음.. 집중하느라 팝콘 산 거 거의 남김..",10
이상한 나라의 수학자,기대 안하고 봤는데 왜 재미있는거임 ㅋ 나쁘지 않았음,8
탑건: 매버릭,고민할 필요가 없음.역시 최고!!!!,10
탑건: 매버릭,OST 나오는 순간부터 게임 오버.. 오래 기다린만큼 무엇과도 비교될 수 없는 훌륭한 영화,10
탑건: 매버릭,영화관에서 처음으로 3번봤다. 나보다 더본사람 많을지도 ㅋㅋ,10
탑건: 매버릭,정말 재밌었습니다. 영화관에서 꼭 봐야하는 영화!,10
탑건: 매버릭,대박~ 감동 너무 잘 봤습니다 감사합니다 톰형,10
탑건: 매버릭,오전에 중1 아들이랑 같이 보고 왔는데 아들 친구 녀석도 극장에서 만나고 멋진 비행 장면 멋있었고 부작용이 있다면 내 차도 수퍼소닉의 속도로 운전하려 했다는거 ㅋㅋㅋ주차하다 오른쪽 사이드 미러 나갈뻔한거 ㅋㅋㅋㅋ3년만에 극장가서 영화 봄.,8
탑건: 매버릭,그저 갓…톰 형 멋있어요,10
판도라,"연기가 너무 좋았고, 실제 원전사고 일어났을때를 상상하기만 해도 끔찍해서 더 몰입이 되었던것같다.",10
탑건: 매버릭,어제 영화 보고 나오자마자 진한 감동이 ㅠㅠ cgv 4dx로 보시는거 추천해요 :),10
탑건: 매버릭,재밌닷!!!  재미있어요 ~~~,10
탑건: 매버릭,진심 뜨거워지는 영화는 오랜만입니다.내 인생 4DX로 예매하지 않은 나 후회중입니다...집가서 1 다시봐야지,10
수어사이드 스쿼드,볼만한 어벤져스??? 근데 너무 데드샷ㆍ할리퀸만 부각된듯...,6
범죄도시2,마동석을 영리하게 사용하고 손석구의 미친 카리스마를 보여줌15세 치고는 좀 잔인함,10
범죄도시2,마동석을 영리하게 사용하고 손석구의 미친 카리스마를 보여줌15세 치고는 좀 잔인함,10
이상한 나라의 수학자,고삐리용 성장 드라마.,7
범죄도시2,음…그냥 뭐….. ㅠ 천만까진..,6
탑건: 매버릭,극장에서 영화를 체험하고 나온 듯한 즐거움,10
마녀(魔女) Part2. The Other One,너무 평점에 연연하지 말고 1편 재밌게 봤으면 2편도 무조건 봐라 절대 후회하지 않는다~~,10
탑건: 매버릭,완벽주의자가 작정하고 만들면 이런 영화가 아닐까?,10
탑건: 매버릭,머하나 흠잘을때가 없는 최고의 영화였다..,10
마녀(魔女) Part2. The Other One,3가 기대되는 영화입니다,7
